{"$schema":"./challenger-episode-economic-plan-v1.schema.json","authority":{"broker_request_count":0,"fee_override_allowed":false,"market_request_count":0,"order_submission_count":0,"price_override_allowed":false,"state_write_count":0,"time_override_allowed":false},"calculation_order":["ENTRY_EXECUTION_MINUTE","EXIT_EXECUTION_MINUTE","ENTRY_FILL","EXIT_FILL","QUANTITY","ENTRY_NOTIONAL","EXIT_NOTIONAL","ENTRY_FEE","EXIT_FEE","GROSS_PNL","NET_PNL","NET_RETURN","POSITIVE_LABEL"],"design_commit":"dd3ab06","economic_policy":{"archive_period_kind":"DAILY","assumed_taker_fee_rate_per_side":"0.0015","binary_float_allowed":false,"cost_policy":"ASSUMED_TAKER_15BPS_PER_SIDE_V1","decimal_arithmetic_only":true,"direction":"LONG","entry_fee_formula":"entry_fill*quantity*0.0015","entry_fill_formula":"ROUND_UP(entry_minute_high*(1+0.001),0.01)","entry_source_field":"high","execution_minute_rule":"FIRST_WHOLE_UTC_MINUTE_STRICTLY_AFTER_DECISION_RECORDED_AT","exit_fee_formula":"exit_fill*quantity*0.0015","exit_fill_formula":"ROUND_DOWN(exit_minute_low*(1-0.001),0.01)","exit_source_field":"low","fill_policy":"OFFICIAL_DAILY_1M_WORST_BAR_PLUS_10BPS_V1","gross_pnl_formula":"(exit_fill-entry_fill)*quantity","historical_fallback_allowed":false,"interval":"1m","market":"SPOT","net_pnl_formula":"gross_pnl-entry_fee-exit_fee","net_return_formula":"net_pnl/1000","policy_hash":"32c81160e936caf4253e0eabe46104fde5f6b747e0525fa2ea916c028dea82f9","policy_version":"CHALLENGER_EPISODE_ECONOMIC_PROXY_V1","positive_label_rule":"1_IF_NET_RETURN_STRICTLY_GREATER_THAN_0","price_tick_usdt":"0.01","provider":"BINANCE_PUBLIC_DATA","quantity_formula":"ROUND_DOWN(1000/entry_fill,0.0001)","quantity_step_eth":"0.0001","reference_capital_usdt":"1000","slippage_rate_per_side":"0.001","symbol":"ETHUSDT"},"eligibility":{"execution":"INELIGIBLE_PROXY_NOT_REAL_FILL","measurement_plan":"PREREGISTERED_BEFORE_OUTCOME","paper":"INELIGIBLE_NO_COMPLETED_EPISODE","profitability":"INELIGIBLE","release_oos":"INELIGIBLE_FORWARD_COLLECTION_ONLY"},"first_episode":{"entry_decision_hash":"c7ee6bfac0ac1da6986a9eb5089cc6cc8e2de520937935edbb8df45731b34ac7","entry_decision_id":"challenger_decision_7108b0226b32c858217ce3668d69b8cbb3efea614091a632f1c709afb80b4106","entry_execution_minute":"2026-07-29T00:03:00.000Z","entry_recorded_at":"2026-07-29T00:02:06.752Z","entry_scheduled_for":"2026-07-29T00:00:00.000Z","episode_id":"challenger_episode_45c86b2c0c1610d890c2d956915803c4b375b2838a66215f3f87311c8342be91","exit_execution_minute_rule":"FIRST_WHOLE_UTC_MINUTE_STRICTLY_AFTER_DECISION_RECORDED_AT","minimum_hold_until":"2026-07-29T08:00:00.000Z","vertical_exit_at":"2026-07-30T00:00:00.000Z"},"package_baseline":"0.36.0","plan_hash":"fa43e1bb24ac0e9d70c82a3d09f03ca43a5f99c429f43e6c67d6e68029732831","plan_id":"challenger_episode_economic_plan_e5c86696889d209373ce536ee0f54be72e59d7de96b6868cd5ab0358491985a4","registered_at":"2026-07-29T02:15:24.000Z","schema_version":"1.0.0","source_contract":{"archive_and_checksum_required":true,"archive_base":"https://data.binance.vision/data/spot/daily/klines/ETHUSDT/1m/","complete_daily_row_count":1440,"entry_exit_cross_day_source_count":2,"entry_exit_same_day_source_count":1,"exact_selected_raw_row_required":true,"request_constructor":"ALLOWLISTED_HISTORICAL_ARCHIVE_REQUEST","third_party_or_rest_fallback_allowed":false},"source_first_slot_receipt":{"file_sha256":"b1b03bbe584386d3199cef3561fe22b4c92c3f359429ec43838d2b00a9566e43","observed_at":"2026-07-29T00:15:46.913Z","receipt_hash":"76acd1f21dbd0f4c71b45213a4d4d3983f7c3707ac77006b56da2675ecfa9521","receipt_id":"challenger_first_slot_receipt_fcc86fe447ab8b2728a9bcd80371c26c9a30f59cec0b01306b278392b28d3c2b"},"status":"PREREGISTERED_WAITING_FIRST_EPISODE_COMPLETION_AND_DAILY_ARCHIVE","warnings":["NO_OUTCOME_OR_EXIT_PRICE_WAS_OBSERVED","NO_MARKET_REQUEST_WAS_MADE","DAILY_ARCHIVE_ROWS_WILL_BE_EXECUTION_PROXIES_NOT_REAL_FILLS","ARCHIVE_OUTCOME_SOURCE_IS_NOT_PIT_MARKET_INPUT","SINGLE_EPISODE_CANNOT_ESTABLISH_EDGE","NO_PROFITABILITY_CLAIM"]}
